{
  "ok": true,
  "command": "facet_schema.revision.show",
  "response_contract": "spine.facet-schema-revision-readback.v1",
  "root": {
    "facet_schema_id": "facet_schema_B",
    "owner": {
      "owner_kind": "subject_group",
      "owner_group_id": "example-owner-group"
    },
    "schema_key": "legacy_details",
    "current_revision_id": "facet_schema_revision_B2",
    "status": "active"
  },
  "revision": {
    "facet_schema_id": "facet_schema_B",
    "facet_schema_revision_id": "facet_schema_revision_B1",
    "revision_number": "1",
    "definition": {
      "display_name": "Legacy flight details",
      "description": null,
      "compatible_item_types": [
        "event"
      ],
      "fields": [
        {
          "key": "flight_number",
          "type": "text",
          "max_length": "32",
          "required": true,
          "queryable": true
        }
      ]
    },
    "definition_hash": "9d05f95b9e6a03489b759c4f7f82a38f8df4c52ddfc449d23e9319b3e0b1d1f6"
  }
}
